{
  "schema_version": "2.0.0",
  "source_id": "EU-2009-810",
  "source_revision": "0.3.0",
  "url": "https://eur-lex.europa.eu/eli/reg/2009/810/",
  "authority": "European Union / EUR-Lex",
  "title": "Regulation (EC) No 810/2009 establishing a Community Code on Visas (Visa Code)",
  "source_type": "Legislation",
  "language": null,
  "official_status": "UNCONFIRMED",
  "official_status_basis": "Identified as official in supplied EP001-05 research; not independently inspected or verified.",
  "retrieved_at": null,
  "verified_at": null,
  "source_version": null,
  "consolidation_date": null,
  "published_at": null,
  "effective_from": null,
  "effective_to": null,
  "effective_date_known": false,
  "effective_date_notes": "Not supplied. Consolidation identifiers, where present, are not effective-date determinations.",
  "reference_copy": null,
  "reviewer_notes": "EP001-05 supplies the legal source family URL, not a specific consolidation. Preserved under the same source ID with a separate revision; no equivalence or applicable consolidation inferred.",
  "metadata_completeness": "INCOMPLETE",
  "provenance": {
    "state": "SUPPLIED_REFERENCE",
    "retrieval_method": null,
    "inspected_by": null,
    "inspected_at": null,
    "inspection_basis": null
  }
}
