{
  "schema_version": "2.0.0",
  "source_id": "EU-2009-810",
  "source_revision": "0.4.0",
  "url": "https://eur-lex.europa.eu/legal-content/EN/TXT/PDF/?uri=CELEX:02009R0810-20240611",
  "authority": "European Union / EUR-Lex",
  "title": "Regulation (EC) No 810/2009 establishing a Community Code on Visas (Visa Code), current consolidated text used during research.",
  "source_type": "Legislation",
  "language": null,
  "official_status": "UNCONFIRMED",
  "official_status_basis": "Identified as official in supplied EP001-06 research; no independent verification or named review supplied.",
  "retrieved_at": null,
  "verified_at": null,
  "source_version": null,
  "consolidation_date": "2024-06-11",
  "published_at": null,
  "effective_from": null,
  "effective_to": null,
  "effective_date_known": false,
  "effective_date_notes": "Not supplied. Consolidation identifiers, where present, are not effective-date determinations.",
  "reference_copy": null,
  "reviewer_notes": "Supplied EP001-06 reference only; no retrieval or inspection. PDF reference explicitly identifies 2024-06-11 consolidation. Prior 0.1.0 ELI reference names the same date but content/representation equivalence was not inspected. Prior June 28 and unversioned references remain separate. Current applicability is supplied, not independently verified.",
  "metadata_completeness": "INCOMPLETE",
  "provenance": {
    "state": "SUPPLIED_REFERENCE",
    "retrieval_method": null,
    "inspected_by": null,
    "inspected_at": null,
    "inspection_basis": null
  }
}
