{
  "schema_version": "2.0.0",
  "source_id": "IE-TRAVEL-CONFIRMATION-EXTENSION-2026",
  "source_revision": "0.1.0",
  "url": "https://www.irishimmigration.ie/isd-announce-extension-to-travel-confirmation-notice/",
  "authority": "Immigration Service Delivery / Department of Justice, Home Affairs and Migration, Ireland",
  "title": "ISD announce extension to Travel Confirmation Notice",
  "source_type": "Government guidance",
  "language": null,
  "official_status": "UNCONFIRMED",
  "official_status_basis": "Identified as official in supplied EP001-05 research; not independently inspected or verified.",
  "retrieved_at": null,
  "verified_at": null,
  "source_version": null,
  "consolidation_date": null,
  "published_at": "2026-01-30",
  "effective_from": null,
  "effective_to": "2026-02-28",
  "effective_date_known": false,
  "effective_date_notes": "Supplied historical arrangement dates only; not a current September 2026 general rule. Dates unverified; unknown start remains null.",
  "reference_copy": null,
  "reviewer_notes": "Supplied EP001-05 reference only. No retrieval, inspection, reviewer or independent date/version verification. Absent metadata remains null.",
  "metadata_completeness": "INCOMPLETE",
  "provenance": {
    "state": "SUPPLIED_REFERENCE",
    "retrieval_method": null,
    "inspected_by": null,
    "inspected_at": null,
    "inspection_basis": null
  }
}
