{
  "schema_version": "2.0.0",
  "source_id": "FRANCE-VISAS-IRELAND",
  "source_revision": "0.3.0",
  "url": "https://france-visas.gouv.fr/en/irlande",
  "authority": "France-Visas / French government",
  "title": "France-Visas \u2014 Ireland",
  "source_type": "Consular instructions",
  "language": null,
  "official_status": "UNCONFIRMED",
  "official_status_basis": "Identified as official in supplied EP001-03 research; no independent confirmation or review provenance supplied.",
  "retrieved_at": null,
  "verified_at": null,
  "source_version": null,
  "consolidation_date": null,
  "published_at": null,
  "effective_from": null,
  "effective_to": null,
  "effective_date_known": false,
  "effective_date_notes": "Not supplied. Consolidation identifiers, where present, are not effective-date determinations.",
  "reference_copy": null,
  "reviewer_notes": "Supplied EP001-03 reference only. No retrieval or inspection. Supplied non-www URL preserved separately from the existing www reference without asserting redirect/content equivalence. Operational platform-change date 2026-05-12 is supplied, not a general legal effective date.",
  "metadata_completeness": "INCOMPLETE",
  "provenance": {
    "state": "SUPPLIED_REFERENCE",
    "retrieval_method": null,
    "inspected_by": null,
    "inspected_at": null,
    "inspection_basis": null
  }
}
