{
  "schema_version": "2.0.0",
  "source_id": "FRANCE-VISAS-SHORT-STAY",
  "source_revision": "0.1.0",
  "url": "https://www.france-visas.gouv.fr/en/visa-de-court-sejour",
  "authority": "France-Visas / French government",
  "title": "Short-stay visa",
  "source_type": "Government guidance",
  "language": null,
  "official_status": "UNCONFIRMED",
  "official_status_basis": "Identified as an approved official source in the supplied EP001-02 external research. No independent provenance confirmation or named reviewer record supplied.",
  "retrieved_at": null,
  "verified_at": null,
  "source_version": null,
  "consolidation_date": null,
  "published_at": null,
  "effective_from": null,
  "effective_to": null,
  "effective_date_known": false,
  "effective_date_notes": "Not supplied. Consolidation identifiers, where present, are not effective-date determinations.",
  "reference_copy": null,
  "reviewer_notes": "Registered solely from supplied EP001-02 material. No source retrieval, inspection, verbatim excerpt or reference copy. Applicable source version remains unknown.",
  "metadata_completeness": "INCOMPLETE",
  "provenance": {
    "state": "SUPPLIED_REFERENCE",
    "retrieval_method": null,
    "inspected_by": null,
    "inspected_at": null,
    "inspection_basis": null
  }
}
